{
  "project_id": "example-project",
  "project_profile_revision": "example-project-profile-v2",
  "index_version": "1.0",
  "index_id": "CG-example-gitnexus",
  "index_revision": "fixture-r1",
  "purpose": "code_navigation_only",
  "repository_root": "source",
  "source_revision": "0123456789abcdef0123456789abcdef01234567",
  "source_state": "exported_snapshot",
  "adapter": {
    "id": "gitnexus",
    "version": "1.6.10",
    "license_id": "PolyForm-Noncommercial-1.0.0",
    "source_url": "https://github.com/abhigyanpatwari/GitNexus"
  },
  "graph_format": "gitnexus-ladybugdb",
  "coverage": {
    "files_indexed": 12,
    "symbols_indexed": 180,
    "edges_indexed": 420,
    "languages": ["python"]
  },
  "artifacts": [
    {
      "artifact_ref": "code-intelligence/indexes/example-gitnexus/graph.fixture",
      "artifact_revision": "fixture-r1",
      "artifact_sha256": "3333333333333333333333333333333333333333333333333333333333333333"
    }
  ],
  "limitations": [
    "Synthetic contract fixture; GitNexus was not installed or executed.",
    "PolyForm Noncommercial 1.0.0 restricts use to noncommercial purposes unless separately licensed."
  ],
  "external_upload": false,
  "contains_secrets": false,
  "created_at": "2026-08-31T12:00:00Z"
}
