{
  "project_id": "example-project",
  "project_profile_revision": "example-project-profile-v2",
  "index_version": "1.0",
  "index_id": "CG-example-main",
  "index_revision": "r1",
  "purpose": "code_navigation_only",
  "repository_root": "source",
  "source_revision": "0123456789abcdef0123456789abcdef01234567",
  "source_state": "exported_snapshot",
  "adapter": {
    "id": "scip",
    "version": "0.6.1",
    "license_id": "Apache-2.0",
    "source_url": "https://github.com/scip-code/scip"
  },
  "graph_format": "scip",
  "coverage": {
    "files_indexed": 12,
    "symbols_indexed": 180,
    "edges_indexed": 420,
    "languages": ["python"]
  },
  "artifacts": [{
    "artifact_ref": "code-intelligence/indexes/example.scip",
    "artifact_revision": "r1",
    "artifact_sha256": "2222222222222222222222222222222222222222222222222222222222222222"
  }],
  "limitations": ["Synthetic fixture does not prove semantic index quality."],
  "external_upload": false,
  "contains_secrets": false,
  "created_at": "2026-08-31T12:00:00Z"
}
